{"challenge":{"campaign_id":"luremandate-conformance-v1","cases":[{"case_id":"case-0001","sequence":1,"transaction":{"approvals":[{"approval_id":"approval-01","approver_id":"approver-operator","approver_role":"operator","decision":"approve","expires_at":"2026-09-05T15:04:10Z","intent_sha256":"32ba09a55d9e3c1329f8fdef3acd7fd9855dde49ec4cce084cf9d8c6271f277f","issued_at":"2026-09-05T15:00:10Z","nonce":"approval-01-nonce"}],"decided_at":"2026-09-05T15:00:20Z","intent":{"action":"apply-change","agent_id":"agent-a","impact_units":10,"intent_id":"intent-01","intent_nonce":"intent-nonce-01","policy_id":"standard-change","proposed_at":"2026-09-05T15:00:00Z","requester_id":"requester-a","resource_id":"synthetic-resource-01","run_id":"mandate-conformance-run-1","tenant_id":"agency-tenant","workload_spiffe_id":"spiffe://example.gov/workload/agent-a"},"intent_sha256":"32ba09a55d9e3c1329f8fdef3acd7fd9855dde49ec4cce084cf9d8c6271f277f","transaction_id":"tx-01"}},{"case_id":"case-0002","sequence":2,"transaction":{"approvals":[{"approval_id":"approval-02-mission","approver_id":"approver-mission","approver_role":"mission-owner","decision":"approve","expires_at":"2026-09-05T15:02:50Z","intent_sha256":"e27d67466fb8b8f873231b8c85ed911c15626a6bfd0bfdf663f010499428954a","issued_at":"2026-09-05T15:01:10Z","nonce":"approval-02-mission-nonce"},{"approval_id":"approval-02-security","approver_id":"approver-security","approver_role":"security-reviewer","decision":"approve","expires_at":"2026-09-05T15:02:50Z","intent_sha256":"e27d67466fb8b8f873231b8c85ed911c15626a6bfd0bfdf663f010499428954a","issued_at":"2026-09-05T15:01:10Z","nonce":"approval-02-security-nonce"}],"decided_at":"2026-09-05T15:01:20Z","intent":{"action":"apply-change","agent_id":"agent-a","impact_units":60,"intent_id":"intent-02","intent_nonce":"intent-nonce-02","policy_id":"high-impact","proposed_at":"2026-09-05T15:01:00Z","requester_id":"requester-a","resource_id":"synthetic-resource-02","run_id":"mandate-conformance-run-1","tenant_id":"agency-tenant","workload_spiffe_id":"spiffe://example.gov/workload/agent-a"},"intent_sha256":"e27d67466fb8b8f873231b8c85ed911c15626a6bfd0bfdf663f010499428954a","transaction_id":"tx-02"}},{"case_id":"case-0003","sequence":3,"transaction":{"approvals":[{"approval_id":"approval-03","approver_id":"requester-a","approver_role":"requester","decision":"approve","expires_at":"2026-09-05T15:06:10Z","intent_sha256":"e5eda7c310d51819a082c00c64de1baedf5bceaf7d9a0ac730ad5f2ca550fcfa","issued_at":"2026-09-05T15:02:10Z","nonce":"approval-03-nonce"}],"decided_at":"2026-09-05T15:02:20Z","intent":{"action":"apply-change","agent_id":"agent-a","impact_units":5,"intent_id":"intent-03","intent_nonce":"intent-nonce-03","policy_id":"standard-change","proposed_at":"2026-09-05T15:02:00Z","requester_id":"requester-a","resource_id":"synthetic-resource-03","run_id":"mandate-conformance-run-1","tenant_id":"agency-tenant","workload_spiffe_id":"spiffe://example.gov/workload/agent-a"},"intent_sha256":"e5eda7c310d51819a082c00c64de1baedf5bceaf7d9a0ac730ad5f2ca550fcfa","transaction_id":"tx-03"}},{"case_id":"case-0004","sequence":4,"transaction":{"approvals":[{"approval_id":"approval-04","approver_id":"approver-mission","approver_role":"mission-owner","decision":"approve","expires_at":"2026-09-05T15:07:10Z","intent_sha256":"e09e59d448d76188a222148d00dc7ee9735c405636b6243c54bcc94b51c1ee6d","issued_at":"2026-09-05T15:03:10Z","nonce":"approval-04-nonce"}],"decided_at":"2026-09-05T15:03:20Z","intent":{"action":"apply-change","agent_id":"agent-a","impact_units":5,"intent_id":"intent-04","intent_nonce":"intent-nonce-04","policy_id":"standard-change","proposed_at":"2026-09-05T15:03:00Z","requester_id":"requester-a","resource_id":"synthetic-resource-04","run_id":"mandate-conformance-run-1","tenant_id":"agency-tenant","workload_spiffe_id":"spiffe://example.gov/workload/agent-a"},"intent_sha256":"e09e59d448d76188a222148d00dc7ee9735c405636b6243c54bcc94b51c1ee6d","transaction_id":"tx-04"}},{"case_id":"case-0005","sequence":5,"transaction":{"approvals":[{"approval_id":"approval-05","approver_id":"approver-operator","approver_role":"operator","decision":"approve","expires_at":"2026-09-05T15:08:10Z","intent_sha256":"0000000000000000000000000000000000000000000000000000000000000000","issued_at":"2026-09-05T15:04:10Z","nonce":"approval-05-nonce"}],"decided_at":"2026-09-05T15:04:20Z","intent":{"action":"apply-change","agent_id":"agent-a","impact_units":5,"intent_id":"intent-05","intent_nonce":"intent-nonce-05","policy_id":"standard-change","proposed_at":"2026-09-05T15:04:00Z","requester_id":"requester-a","resource_id":"synthetic-resource-05","run_id":"mandate-conformance-run-1","tenant_id":"agency-tenant","workload_spiffe_id":"spiffe://example.gov/workload/agent-a"},"intent_sha256":"5d5c2abb2736335be3e5592db2816dd4da71211e93104f1b45027be6b0fec7a3","transaction_id":"tx-05"}},{"case_id":"case-0006","sequence":6,"transaction":{"approvals":[{"approval_id":"approval-06","approver_id":"approver-operator","approver_role":"operator","decision":"approve","expires_at":"2026-09-05T15:05:15Z","intent_sha256":"fb440ae64234aa9461836e84ec0843e2929ada9a96ea9bb4ecaf7c142954a9bc","issued_at":"2026-09-05T15:05:10Z","nonce":"approval-06-nonce"}],"decided_at":"2026-09-05T15:05:20Z","intent":{"action":"apply-change","agent_id":"agent-a","impact_units":5,"intent_id":"intent-06","intent_nonce":"intent-nonce-06","policy_id":"standard-change","proposed_at":"2026-09-05T15:05:00Z","requester_id":"requester-a","resource_id":"synthetic-resource-06","run_id":"mandate-conformance-run-1","tenant_id":"agency-tenant","workload_spiffe_id":"spiffe://example.gov/workload/agent-a"},"intent_sha256":"fb440ae64234aa9461836e84ec0843e2929ada9a96ea9bb4ecaf7c142954a9bc","transaction_id":"tx-06"}},{"case_id":"case-0007","sequence":7,"transaction":{"approvals":[{"approval_id":"approval-01","approver_id":"approver-operator","approver_role":"operator","decision":"approve","expires_at":"2026-09-05T15:04:10Z","intent_sha256":"32ba09a55d9e3c1329f8fdef3acd7fd9855dde49ec4cce084cf9d8c6271f277f","issued_at":"2026-09-05T15:00:10Z","nonce":"approval-01-nonce"}],"decided_at":"2026-09-05T15:06:20Z","intent":{"action":"apply-change","agent_id":"agent-a","impact_units":5,"intent_id":"intent-07","intent_nonce":"intent-nonce-07","policy_id":"standard-change","proposed_at":"2026-09-05T15:06:00Z","requester_id":"requester-a","resource_id":"synthetic-resource-07","run_id":"mandate-conformance-run-1","tenant_id":"agency-tenant","workload_spiffe_id":"spiffe://example.gov/workload/agent-a"},"intent_sha256":"0c9fa980a77202ff1e5cbdac44bdd414f12654e0114de2d7ae8289fb6f7c9455","transaction_id":"tx-07"}},{"case_id":"case-0008","sequence":8,"transaction":{"approvals":[{"approval_id":"approval-08","approver_id":"approver-mission","approver_role":"mission-owner","decision":"approve","expires_at":"2026-09-05T15:08:50Z","intent_sha256":"4846b1c37c260e6000273efec20b9a02777f7b990c23ade0f457f726ad25802a","issued_at":"2026-09-05T15:07:10Z","nonce":"approval-08-nonce"}],"decided_at":"2026-09-05T15:07:20Z","intent":{"action":"apply-change","agent_id":"agent-a","impact_units":5,"intent_id":"intent-08","intent_nonce":"intent-nonce-08","policy_id":"high-impact","proposed_at":"2026-09-05T15:07:00Z","requester_id":"requester-a","resource_id":"synthetic-resource-08","run_id":"mandate-conformance-run-1","tenant_id":"agency-tenant","workload_spiffe_id":"spiffe://example.gov/workload/agent-a"},"intent_sha256":"4846b1c37c260e6000273efec20b9a02777f7b990c23ade0f457f726ad25802a","transaction_id":"tx-08"}},{"case_id":"case-0009","sequence":9,"transaction":{"approvals":[{"approval_id":"approval-09","approver_id":"approver-operator","approver_role":"operator","decision":"approve","expires_at":"2026-09-05T15:12:10Z","intent_sha256":"ec0850a6aefe01bc842f0ec756783d406cf8e7c24724f58848feebb843803b5e","issued_at":"2026-09-05T15:08:10Z","nonce":"approval-09-nonce"}],"decided_at":"2026-09-05T15:08:20Z","intent":{"action":"apply-change","agent_id":"agent-a","impact_units":20,"intent_id":"intent-09","intent_nonce":"intent-nonce-09","policy_id":"standard-change","proposed_at":"2026-09-05T15:08:00Z","requester_id":"requester-a","resource_id":"synthetic-resource-09","run_id":"mandate-conformance-run-1","tenant_id":"agency-tenant","workload_spiffe_id":"spiffe://example.gov/workload/agent-a"},"intent_sha256":"ec0850a6aefe01bc842f0ec756783d406cf8e7c24724f58848feebb843803b5e","transaction_id":"tx-09"}},{"case_id":"case-0010","sequence":10,"transaction":{"approvals":[{"approval_id":"approval-10","approver_id":"approver-operator","approver_role":"operator","decision":"approve","expires_at":"2026-09-05T15:13:10Z","intent_sha256":"ea5d1d0715c2a80e2f7a68df5affbd01fca4a86bfaf0ce9fd94eaf77862d1357","issued_at":"2026-09-05T15:09:10Z","nonce":"approval-10-nonce"}],"decided_at":"2026-09-05T15:09:20Z","intent":{"action":"apply-change","agent_id":"agent-a","impact_units":25,"intent_id":"intent-10","intent_nonce":"intent-nonce-10","policy_id":"standard-change","proposed_at":"2026-09-05T15:09:00Z","requester_id":"requester-a","resource_id":"synthetic-resource-10","run_id":"mandate-conformance-run-1","tenant_id":"agency-tenant","workload_spiffe_id":"spiffe://example.gov/workload/agent-a"},"intent_sha256":"ea5d1d0715c2a80e2f7a68df5affbd01fca4a86bfaf0ce9fd94eaf77862d1357","transaction_id":"tx-10"}},{"case_id":"case-0011","sequence":11,"transaction":{"approvals":[{"approval_id":"approval-11","approver_id":"approver-operator","approver_role":"operator","decision":"approve","expires_at":"2026-09-05T15:14:10Z","intent_sha256":"5213ee0e8db80a692924abb347765bb3543afaca9721689065eb661e2036c95f","issued_at":"2026-09-05T15:10:10Z","nonce":"approval-11-nonce"}],"decided_at":"2026-09-05T15:10:20Z","intent":{"action":"apply-change","agent_id":"agent-a","impact_units":30,"intent_id":"intent-11","intent_nonce":"intent-nonce-11","policy_id":"standard-change","proposed_at":"2026-09-05T15:10:00Z","requester_id":"requester-a","resource_id":"synthe